{
  "proposal_id": "CP-DEMO-001",
  "provider": "openai/gpt-5.6",
  "provider_version": "recorded-fixture-1",
  "source_session": "019f6fc9-488b-7be0-9cff-2e9bfbd7a19f",
  "opportunity_ref": "O-DEMO-001",
  "target_user": {"description": "Product leads coordinating business discovery and coding agents", "need_or_value": "A fast, reviewable handoff into bounded implementation"},
  "economic_buyer": {"description": "Product or engineering leader owning delivery budget", "need_or_value": "Avoided low-value implementation and a reliable audit trail"},
  "job_to_be_done": "Decide whether an MVP is the cheapest sufficient experiment before a coding agent begins implementation.",
  "problem_statement": "Fast code generation can outrun business validation and leave teams without a clear record of who authorized what.",
  "alternatives": ["Approval in chat", "Static PRD", "Agent-inferred permission"],
  "differentiation": "A deterministic kernel treats the commercial model as an advisor and binds actual authority to human-signed, hash-protected scope.",
  "value_proposition": "Make should-we-build decisions faster, falsifiable, and safely executable by repository-local agents.",
  "revenue_or_roi_hypothesis": "Avoiding one unnecessary multi-day build per quarter pays for the team workflow.",
  "distribution_hypothesis": "A repository template and one-command demo will seed adoption inside product-engineering teams.",
  "cost_hypothesis": "A standard-library kernel and existing CI keep adoption and operating costs low.",
  "ranked_hypotheses": [
    {
      "hypothesis_id": "H-PROBLEM-001",
      "rank": 1,
      "type": "problem",
      "statement": "Product leads using coding agents need an enforceable business-readiness handoff before implementation begins.",
      "why_it_matters": "Without this need the workflow creates friction rather than productivity.",
      "falsification_condition": "Fewer than three of five target users report the problem and intent to use a bounded handoff.",
      "evidence_threshold": {"metric": "qualified target-user confirmations", "aggregation": "sum", "operator": ">=", "target": 3, "unit": "of 5 interviews", "minimum_evidence_items": 2, "required_source_types": ["customer_interview"]},
      "kill_or_pivot_trigger": {"action": "pivot", "condition": "The evidence threshold is missed after five independent interviews.", "reason_code": "TARGET_USER_NEED_NOT_SUPPORTED"},
      "status": "untested",
      "evidence_refs": [],
      "confidence": {"score": 45, "scale": "0-100", "rationale": "This is a model-generated recommendation awaiting external evidence."},
      "owner": "agent:commercial-planner",
      "review_at": "2030-07-20T12:00:00Z"
    }
  ],
  "evidence_refs": ["E-MODEL-001"],
  "counterevidence_refs": [],
  "recommended_next_experiment": {
    "experiment_id": "X-INTERVIEW-001",
    "type": "interview",
    "decision_to_unlock": "Determine whether the governed handoff solves a recurring target-user problem.",
    "procedure": "Interview two product leads and preserve both supporting and contradictory observations.",
    "success_condition": "At least one direct observation supports the problem and all contradictions are retained.",
    "failure_condition": "No direct observation supports a recurring problem worth changing workflow for.",
    "estimated_cost": {"amount": 0, "currency": "USD"},
    "deadline": "2030-07-18T12:00:00Z"
  },
  "proposed_mvp_scope": {
    "decision_to_unlock": "Determine whether teams can use a deterministic governed handoff before coding-agent implementation.",
    "in_scope": ["Readiness assessment", "Human authorization", "Local demo"],
    "out_of_scope": ["Production deployment", "External customer claims"],
    "d0_user_journey": ["Import proposal", "Assess evidence", "Authorize bounded scope", "Start in-scope task"],
    "budget_cap": {"amount": 1000, "currency": "USD"},
    "deadline": "2030-07-21T16:00:00Z"
  },
  "recommendation": "EXPERIMENT_REQUIRED",
  "confidence": {"score": 45, "scale": "0-100", "rationale": "The proposal is advisory and intentionally precedes external evidence."},
  "rationale_summary": "Run the cheaper interview experiment before considering the bounded MVP charter.",
  "limitations": ["Recorded fixture rather than a live API call", "Model output cannot issue a warrant", "Synthetic evidence is not market validation"],
  "generated_at": "2026-07-17T12:00:00Z"
}
